<?xml version='1.0' encoding='UTF-8'?>
<!-- This document was created with Syntext Serna Free. -->
<arrayexpress xmlns:xsi="http://www.w3.org/2001/XMLSchema-instance" xsi:noNamespaceSchemaLocation="arrayexschema.xsd">
  <results>
    <result>
      <gene>
        <id>YFL032W</id>
        <name>YFL032W</name>
        <ensemblProteinIds>
          <ensemblProteinId>YFL032W</ensemblProteinId>
        </ensemblProteinIds>
        <ensemblGeneId>YFL032W</ensemblGeneId>
        <organism>Saccharomyces cerevisiae</organism>
      </gene>
      <expressions>
        <expression>
          <ef>growth_condition</ef>
          <efv>control</efv>
          <experiments>
            <experiment>
              <accession>E-GEOD-1311</accession>
              <pvalue>0.047000002</pvalue>
              <expression>DOWN</expression>
            </experiment>
          </experiments>
          <upExperiments>0</upExperiments>
          <downExperiments>1</downExperiments>
          <nonDEExperiments>0</nonDEExperiments>
          <upPvalue>1.0</upPvalue>
          <downPvalue>0.04700000211596489</downPvalue>
        </expression>
      </expressions>
    </result>
    <result>
      <gene>
        <ensemblProteinIds>
          <ensemblProteinId>YCR057C</ensemblProteinId>
        </ensemblProteinIds>
        <ensemblGeneId>YCR057C</ensemblGeneId>
        <organism>Saccharomyces cerevisiae</organism>
        <id>YCR057C</id>
        <name>PWP2</name>
      </gene>
      <expressions>
        <expression>
          <ef>growth_condition</ef>
          <efv>3 days in YPD (control)</efv>
          <experiments>
            <experiment>
              <accession>E-GEOD-8379</accession>
              <pvalue>0.0</pvalue>
              <expression>DOWN</expression>
            </experiment>
          </experiments>
          <upExperiments>0</upExperiments>
          <downExperiments>1</downExperiments>
          <nonDEExperiments>0</nonDEExperiments>
          <upPvalue>1.0</upPvalue>
          <downPvalue>0.0</downPvalue>
        </expression>
      </expressions>
    </result>
    <result>
      <gene>
        <ensemblProteinIds>
          <ensemblProteinId>YMR312W</ensemblProteinId>
        </ensemblProteinIds>
        <ensemblGeneId>YMR312W</ensemblGeneId>
        <organism>Saccharomyces cerevisiae</organism>
        <id>YMR312W</id>
        <name>ELP6</name>
      </gene>
      <expressions>
        <expression>
          <ef>growth_condition</ef>
          <efv>3 days in YPD (control)</efv>
          <experiments>
            <experiment>
              <accession>E-GEOD-8379</accession>
              <pvalue>0.0010</pvalue>
              <expression>DOWN</expression>
            </experiment>
          </experiments>
          <upExperiments>0</upExperiments>
          <downExperiments>1</downExperiments>
          <nonDEExperiments>0</nonDEExperiments>
          <upPvalue>1.0</upPvalue>
          <downPvalue>0.0010000000474974513</downPvalue>
        </expression>
      </expressions>
    </result>
    <result>
      <gene>
        <ensemblGeneId>YER086W</ensemblGeneId>
        <organism>Saccharomyces cerevisiae</organism>
        <id>YER086W</id>
        <name>ILV1</name>
      </gene>
      <expressions>
        <expression>
          <ef>growth_condition</ef>
          <efv>control</efv>
          <experiments>
            <experiment>
              <accession>E-GEOD-1312</accession>
              <pvalue>0.0</pvalue>
              <expression>UP</expression>
            </experiment>
            <experiment>
              <accession>E-GEOD-1313</accession>
              <pvalue>0.0</pvalue>
              <expression>UP</expression>
            </experiment>
          </experiments>
          <upExperiments>5</upExperiments>
          <downExperiments>0</downExperiments>
          <nonDEExperiments>0</nonDEExperiments>
          <upPvalue>0.0</upPvalue>
          <downPvalue>1.0</downPvalue>
        </expression>
      </expressions>
    </result>
  </results>
</arrayexpress>